file,id,title,field_model,field_description
IMG_1410.tif,01,Small boats in Havana Harbour,25,Taken on vacation in Cuba.
IMG_2549.jp2,02,Manhatten Island,25,"Taken from the ferry from downtown New York to Highlands, NJ. Weather was windy."
IMG_2940.JPG,03,Looking across Burrard Inlet,25,View from Deep Cove to Burnaby Mountain. Simon Fraser University is visible on the top of the mountain in the distance.
IMG_2958.JPG,04,Amsterdam waterfront,25,Amsterdam waterfront on an overcast day.
IMG_5083.JPG,05,Alcatraz Island,25,"Taken from Fisherman's Wharf, San Francisco."
